{
  "schemaVersion": "recipe_extraction.v1",
  "status": "extracted",
  "recipeName": "Classic Pancakes",
  "description": "Fluffy homemade pancakes perfect for breakfast.",
  "prepTime": "5 minutes",
  "cookTime": "10 minutes",
  "totalTime": "15 minutes",
  "servings": "4",
  "ingredients": [
    {
      "quantity": "1.5",
      "unit": "cups",
      "name": "all-purpose flour",
      "note": "",
      "originalText": "1.5 cups all-purpose flour"
    },
    {
      "quantity": "3.5",
      "unit": "teaspoons",
      "name": "baking powder",
      "note": "",
      "originalText": "3.5 teaspoons baking powder"
    }
  ],
  "instructions": [
    {
      "stepNumber": 1,
      "text": "Mix flour and baking powder in a large bowl."
    },
    {
      "stepNumber": 2,
      "text": "Add milk and egg, stir until smooth."
    }
  ]
}
